[
  {
    "id": "trade-001",
    "market": "0x1234567890abcdef1234567890abcdef1234567890abcdef1234567890abcdef",
    "price": "0.45",
    "size": "50.0",
    "side": "BUY",
    "asset_id": "1111111111111111111111111111111111111111111111111111111111111111",
    "created_at": "2026-07-23T10:00:00Z",
    "status": "MATCHED"
  },
  {
    "id": "trade-002",
    "market": "0x1234567890abcdef1234567890abcdef1234567890abcdef1234567890abcdef",
    "price": "0.44",
    "size": "100.0",
    "side": "SELL",
    "asset_id": "1111111111111111111111111111111111111111111111111111111111111111",
    "created_at": "2026-07-23T10:05:00Z",
    "status": "MATCHED"
  }
]